Profesión;Edad;Género;Pericia;Dispositivo;Tiempo (seg);Completada;Comentario Usuario;Propuesta Mejora;Valoración;Observaciones del Observador
Estudiante Ingeniería Informática;21;;10;Tablet;134.00;SÍ;Las migas no me llevan a inicio;Mejorar las migas de navegación y el html cargado sobre la información del circuito, que no muestra las imágenes correctamente.;8;Las migas de navegación llevan a la pestaña de Piloto en vez de a la de Inicio. El proyecto no está completamente finalizado y faltan detalles que rematar, como las imágenes cargadas en el html del circuito o la introducción de datos del usuario mediante un formulario en la web.
Estudiante fp de informática;18;Masculino;7;Teléfono;351.20;SÍ;me gustó mucho;no sé en qué formato poner las respuestas y no encontré bien la hora de la carrera. Fotos muy grandes;10;Especificar el formato de la pregunta, para que los usuarios entiendan cuando meter un numero y cuando introducir un texto. Imáges no se redimensionan bien
administrativa;46;Femenino;8;Ordenador;270.47;SÍ;no entendi bien la pregunta de poblacion pensaba  que se  referia a un lugar y no a un numero;especificar mejor las preguntas;9;Especificar que la pregunta de población se refiere a un número. Mejorar la visión de la hora. Mejorar el redimensionamiento de imágenes
jubilada;70;Femenino;6;Tablet;542.15;SÍ;dificil leer texto pequeño;letra más grande y especificar mejor lo que piden en las preguntas;8;Mejorar el tamaño de letra de la aplicación. Especificar el formato de respuesta en el formulario. 
jubilado;75;Masculino;3;Ordenador;815.40;SÍ;muy bonito pero a veces dificil de entender;se me hizo complicada alguna pregunta que no entendí. ;9;Especificar mejor a que se refiere la pregunta de dimensión del tablero de cartas.
estudiante de la eso;15;Femenino;7;Tablet;333.97;SÍ;muy buena web;nada;10;Mejorar la explicación en la página Circuito. Explicar que se permite subir un archivo interno en formato html para visualizarlo, y así ver datos adicionales que pueden ser útiles
soldador;51;Masculino;5;Teléfono;625.30;SÍ;una pagina web muy profesional;lo he visto todo bien;10;No se han encontrado mejoras que realizar.
